[debug] [2025-06-27T13:07:01.743Z] ----------------------------------------------------------------------
[debug] [2025-06-27T13:07:01.746Z] Command:       C:\Program Files\nodejs\node.exe C:\Users\Dan\AppData\Roaming\npm\node_modules\firebase-tools\lib\bin\firebase.js deploy
[debug] [2025-06-27T13:07:01.746Z] CLI Version:   13.29.3
[debug] [2025-06-27T13:07:01.746Z] Platform:      win32
[debug] [2025-06-27T13:07:01.746Z] Node Version:  v20.6.1
[debug] [2025-06-27T13:07:01.746Z] Time:          Fri Jun 27 2025 13:07:01 GMT+0000 (Greenwich Mean Time)
[debug] [2025-06-27T13:07:01.746Z] ----------------------------------------------------------------------
[debug] 
[debug] [2025-06-27T13:07:01.749Z] >>> [apiv2][query] GET https://firebase-public.firebaseio.com/cli.json [none]
[debug] [2025-06-27T13:07:02.013Z] Object "" in "firebase.json" has unknown property: {"additionalProperty":"frameworks"}
[debug] [2025-06-27T13:07:02.019Z] > command requires scopes: ["email","openid","https://www.googleapis.com/auth/cloudplatformprojects.readonly","https://www.googleapis.com/auth/firebase","https://www.googleapis.com/auth/cloud-platform"]
[debug] [2025-06-27T13:07:02.020Z] > authorizing via signed-in user (deekayexq@gmail.com)
[debug] [2025-06-27T13:07:02.020Z] [iam] checking project amplify-ghana for permissions ["firebase.projects.get","firebasehosting.sites.update"]
[debug] [2025-06-27T13:07:02.021Z] Checked if tokens are valid: false, expires at: 1744043920771
[debug] [2025-06-27T13:07:02.021Z] Checked if tokens are valid: false, expires at: 1744043920771
[debug] [2025-06-27T13:07:02.021Z] > refreshing access token with scopes: []
[debug] [2025-06-27T13:07:02.022Z] >>> [apiv2][query] POST https://www.googleapis.com/oauth2/v3/token [none]
[debug] [2025-06-27T13:07:02.022Z] >>> [apiv2][body] POST https://www.googleapis.com/oauth2/v3/token [omitted]
[debug] [2025-06-27T13:07:02.401Z] <<< [apiv2][status] POST https://www.googleapis.com/oauth2/v3/token 200
[debug] [2025-06-27T13:07:02.402Z] <<< [apiv2][body] POST https://www.googleapis.com/oauth2/v3/token [omitted]
[debug] [2025-06-27T13:07:02.410Z] >>> [apiv2][query] POST https://cloudresourcemanager.googleapis.com/v1/projects/amplify-ghana:testIamPermissions [none]
[debug] [2025-06-27T13:07:02.410Z] >>> [apiv2][(partial)header] POST https://cloudresourcemanager.googleapis.com/v1/projects/amplify-ghana:testIamPermissions x-goog-quota-user=projects/amplify-ghana
[debug] [2025-06-27T13:07:02.410Z] >>> [apiv2][body] POST https://cloudresourcemanager.googleapis.com/v1/projects/amplify-ghana:testIamPermissions {"permissions":["firebase.projects.get","firebasehosting.sites.update"]}
[debug] [2025-06-27T13:07:02.433Z] <<< [apiv2][status] GET https://firebase-public.firebaseio.com/cli.json 200
[debug] [2025-06-27T13:07:02.433Z] <<< [apiv2][body] GET https://firebase-public.firebaseio.com/cli.json {"cloudBuildErrorAfter":1594252800000,"cloudBuildWarnAfter":1590019200000,"defaultNode10After":1594252800000,"minVersion":"3.0.5","node8DeploysDisabledAfter":1613390400000,"node8RuntimeDisabledAfter":1615809600000,"node8WarnAfter":1600128000000}
[debug] [2025-06-27T13:07:03.460Z] <<< [apiv2][status] POST https://cloudresourcemanager.googleapis.com/v1/projects/amplify-ghana:testIamPermissions 200
[debug] [2025-06-27T13:07:03.460Z] <<< [apiv2][body] POST https://cloudresourcemanager.googleapis.com/v1/projects/amplify-ghana:testIamPermissions {"permissions":["firebase.projects.get","firebasehosting.sites.update"]}
[debug] [2025-06-27T13:07:03.461Z] Checked if tokens are valid: true, expires at: 1751033221402
[debug] [2025-06-27T13:07:03.461Z] Checked if tokens are valid: true, expires at: 1751033221402
[debug] [2025-06-27T13:07:03.461Z] >>> [apiv2][query] GET https://firebase.googleapis.com/v1beta1/projects/amplify-ghana [none]
[debug] [2025-06-27T13:07:04.161Z] <<< [apiv2][status] GET https://firebase.googleapis.com/v1beta1/projects/amplify-ghana 200
[debug] [2025-06-27T13:07:04.161Z] <<< [apiv2][body] GET https://firebase.googleapis.com/v1beta1/projects/amplify-ghana {"projectId":"amplify-ghana","projectNumber":"278790838056","displayName":"Amplify-Ghana","name":"projects/amplify-ghana","resources":{"hostingSite":"amplify-ghana","locationId":"europe-west6"},"state":"ACTIVE","etag":"1_3d8dcd6e-2509-4f8c-930a-b7688a352170"}
[debug] [2025-06-27T13:07:08.932Z] Checked if tokens are valid: true, expires at: 1751033221402
[debug] [2025-06-27T13:07:08.932Z] Checked if tokens are valid: true, expires at: 1751033221402
[debug] [2025-06-27T13:07:08.933Z] >>> [apiv2][query] GET https://firebasehosting.googleapis.com/v1beta1/projects/amplify-ghana/sites pageToken=&pageSize=10
[debug] [2025-06-27T13:07:10.612Z] <<< [apiv2][status] GET https://firebasehosting.googleapis.com/v1beta1/projects/amplify-ghana/sites 200
[debug] [2025-06-27T13:07:10.613Z] <<< [apiv2][body] GET https://firebasehosting.googleapis.com/v1beta1/projects/amplify-ghana/sites {"sites":[{"name":"projects/amplify-ghana/sites/amplify-ghana","defaultUrl":"https://amplify-ghana.web.app","appId":"1:278790838056:web:d12687053f59e33ecc621d","type":"DEFAULT_SITE"}]}
[debug] [2025-06-27T13:07:10.613Z] Checked if tokens are valid: true, expires at: 1751033221402
[debug] [2025-06-27T13:07:10.613Z] Checked if tokens are valid: true, expires at: 1751033221402
[debug] [2025-06-27T13:07:10.613Z] >>> [apiv2][query] GET https://firebase.googleapis.com/v1beta1/projects/-/webApps/1:278790838056:web:d12687053f59e33ecc621d/config [none]
[debug] [2025-06-27T13:07:11.618Z] <<< [apiv2][status] GET https://firebase.googleapis.com/v1beta1/projects/-/webApps/1:278790838056:web:d12687053f59e33ecc621d/config 200
[debug] [2025-06-27T13:07:11.619Z] <<< [apiv2][body] GET https://firebase.googleapis.com/v1beta1/projects/-/webApps/1:278790838056:web:d12687053f59e33ecc621d/config {"projectId":"amplify-ghana","appId":"1:278790838056:web:d12687053f59e33ecc621d","storageBucket":"amplify-ghana.appspot.com","locationId":"europe-west6","apiKey":"AIzaSyBDLPgELwiKWxGj9ajDEJ2liiMsl2aL3F0","authDomain":"amplify-ghana.firebaseapp.com","messagingSenderId":"278790838056"}
[info] 
   Thank you for trying our early preview of Next.js support on Firebase Hosting.
   During the preview, support is best-effort and breaking changes can be expected. Proceed with caution.

   Documentation: https://firebase.google.com/docs/hosting/frameworks/nextjs
   File a bug: https://github.com/firebase/firebase-tools/issues/new?template=bug_report.md
   Submit a feature request: https://github.com/firebase/firebase-tools/issues/new?template=feature_request.md

   We'd love to learn from you. Express your interest in helping us shape the future of Firebase Hosting: https://goo.gle/41enW5X

[debug] [2025-06-27T13:07:21.787Z] Checked if tokens are valid: true, expires at: 1751033221402
[debug] [2025-06-27T13:07:21.787Z] Checked if tokens are valid: true, expires at: 1751033221402
[debug] [2025-06-27T13:07:21.787Z] >>> [apiv2][query] GET https://firebasehosting.googleapis.com/v1beta1/projects/amplify-ghana/sites/amplify-ghana [none]
[debug] [2025-06-27T13:07:23.015Z] <<< [apiv2][status] GET https://firebasehosting.googleapis.com/v1beta1/projects/amplify-ghana/sites/amplify-ghana 200
[debug] [2025-06-27T13:07:23.015Z] <<< [apiv2][body] GET https://firebasehosting.googleapis.com/v1beta1/projects/amplify-ghana/sites/amplify-ghana {"name":"projects/amplify-ghana/sites/amplify-ghana","defaultUrl":"https://amplify-ghana.web.app","appId":"1:278790838056:web:d12687053f59e33ecc621d","type":"DEFAULT_SITE"}
[info]   ▲ Next.js 14.2.23

[info]   - Environments: .env


[info]    Creating an optimized production build ...

[info] Failed to compile.


[info] ./app/[category]/[articleId]/page.tsx
Error: 
  x Merge conflict marker encountered.
    ,-[C:\Users\Dan\Desktop\projects\amplify-gh-app\app\[category]\[articleId]\page.tsx:22:1]
 22 |         title: "Article Not Found",
 23 |         description: "The article you are looking for does not exist.",
 24 |         images: ["/default-thumbnail.jpg"],
 25 | <<<<<<< HEAD
    : ^^^^^^^
 26 |         url: `https://amplifyghana.com/news/${category}/${articleId}`,
 27 | =======
 27 |         url: `https://mywebsite.com/news/${category}/${articleId}`,
    `----

  x Merge conflict marker encountered.
    ,-[C:\Users\Dan\Desktop\projects\amplify-gh-app\app\[category]\[articleId]\page.tsx:24:1]
 24 |         images: ["/default-thumbnail.jpg"],
 25 | <<<<<<< HEAD
 26 |         url: `https://amplifyghana.com/news/${category}/${articleId}`,
 27 | =======
    : ^^^^^^^
 28 |         url: `https://mywebsite.com/news/${category}/${articleId}`,
 29 | >>>>>>> a01724bb8ae2e78ae0646862e816360def73b6de
 29 |       },
    `----

  x Merge conflict marker encountered.
    ,-[C:\Users\Dan\Desktop\projects\amplify-gh-app\app\[category]\[articleId]\page.tsx:26:1]
 26 |         url: `https://amplifyghana.com/news/${category}/${articleId}`,
 27 | =======
 28 |         url: `https://mywebsite.com/news/${category}/${articleId}`,
 29 | >>>>>>> a01724bb8ae2e78ae0646862e816360def73b6de
    : ^^^^^^^
 30 |       },
 31 |       twitter: {
 31 |         card: "summary_large_image",
    `----

  x Merge conflict marker encountered.
    ,-[C:\Users\Dan\Desktop\projects\amplify-gh-app\app\[category]\[articleId]\page.tsx:41:1]
 41 | 
 42 |   return {
 43 |     title: `${article.title} | Amplify Ghana`,
 44 | <<<<<<< HEAD
    : ^^^^^^^
 45 |     description: article.summary || "Read the latest news and articles here!",
 46 |     openGraph: {
 46 |       title: article.title,
    `----

  x Merge conflict marker encountered.
    ,-[C:\Users\Dan\Desktop\projects\amplify-gh-app\app\[category]\[articleId]\page.tsx:48:1]
 48 |       description: article.summary || "Read the latest news and articles here!",
 49 |       images: [article.image || "/default-thumbnail.jpg"],
 50 |       url: `https://www.amplifyghana.com/${category}/${articleId}`,
 51 | =======
    : ^^^^^^^
 52 |     description: article.description || "Read the latest news and articles here!",
 53 |     openGraph: {
 53 |       title: article.title,
    `----

  x Merge conflict marker encountered.
    ,-[C:\Users\Dan\Desktop\projects\amplify-gh-app\app\[category]\[articleId]\page.tsx:55:1]
 55 |       description: article.description || "Read the latest news and articles here!",
 56 |       images: [article.image || "/default-thumbnail.jpg"],
 57 |       url: `https://mywebsite.com/news/${category}/${articleId}`,
 58 | >>>>>>> a01724bb8ae2e78ae0646862e816360def73b6de
    : ^^^^^^^
 59 |       type: "article",
 60 |     },
 60 |     twitter: {
    `----

  x Merge conflict marker encountered.
    ,-[C:\Users\Dan\Desktop\projects\amplify-gh-app\app\[category]\[articleId]\page.tsx:61:1]
 61 |     twitter: {
 62 |       card: "summary_large_image",
 63 |       title: article.title,
 64 | <<<<<<< HEAD
    : ^^^^^^^
 65 |       description: article.summary || "Check out this article!",
 66 | =======
 66 |       description: article.description || "Check out this article!",
    `----

  x Merge conflict marker encountered.
    ,-[C:\Users\Dan\Desktop\projects\amplify-gh-app\app\[category]\[articleId]\page.tsx:63:1]
 63 |       title: article.title,
 64 | <<<<<<< HEAD
 65 |       description: article.summary || "Check out this article!",
 66 | =======
    : ^^^^^^^
 67 |       description: article.description || "Check out this article!",
 68 | >>>>>>> a01724bb8ae2e78ae0646862e816360def73b6de
 68 |       images: [article.image || "/default-thumbnail.jpg"],
    `----

  x Merge conflict marker encountered.
    ,-[C:\Users\Dan\Desktop\projects\amplify-gh-app\app\[category]\[articleId]\page.tsx:65:1]
 65 |       description: article.summary || "Check out this article!",
 66 | =======
 67 |       description: article.description || "Check out this article!",
 68 | >>>>>>> a01724bb8ae2e78ae0646862e816360def73b6de
    : ^^^^^^^
 69 |       images: [article.image || "/default-thumbnail.jpg"],
 70 |     },
 70 |   };
    `----

  x Expected ',', got ';'
    ,-[C:\Users\Dan\Desktop\projects\amplify-gh-app\app\[category]\[articleId]\page.tsx:68:1]
 68 | >>>>>>> a01724bb8ae2e78ae0646862e816360def73b6de
 69 |       images: [article.image || "/default-thumbnail.jpg"],
 70 |     },
 71 |   };
    :    ^
 72 | }
 73 | 
 73 | const Article = ({ params }: Props) => {
    `----

Caused by:
    Syntax Error

Import trace for requested module:
./app/[category]/[articleId]/page.tsx

./app/playlists/Playlists.tsx
Error: 
  x cannot reassign to a variable declared with `const`
    ,-[C:\Users\Dan\Desktop\projects\amplify-gh-app\app\playlists\Playlists.tsx:11:1]
 11 | 
 12 | const PLAYLIST_BUTTON_TEXT = "LISTEN";
 13 | 
 14 | const Playlists = ({ isPlayListManager, playlists }) => {
    :                                         ^^^^|^^^^
    :                                             `-- cannot reassign
 15 |   const [user, setUser] = useState(null);
 16 |   const [playlists, setPlaylists] = useState([]);
    :          ^^^^|^^^^
    :              `-- const variable was declared here
 17 |   const [isLoading, setIsLoading] = useState(true);
 18 |   const [expandedPlaylistIds, setExpandedPlaylistIds] = useState([]);
 19 |   const [textLimit, setTextLimit] = useState(700);
    `----

Import trace for requested module:
./app/playlists/Playlists.tsx
./app/playlists/page.js


[info] 

[info] > Build failed because of webpack errors

[debug] [2025-06-27T13:07:38.532Z] Error: ENOENT: no such file or directory, open 'C:\Users\Dan\Desktop\projects\amplify-gh-app\.next\server\middleware-manifest.json'
[error] 
[error] Error: An unexpected error has occurred.
[debug] [2025-06-27T13:09:42.150Z] ----------------------------------------------------------------------
[debug] [2025-06-27T13:09:42.153Z] Command:       C:\Program Files\nodejs\node.exe C:\Users\Dan\AppData\Roaming\npm\node_modules\firebase-tools\lib\bin\firebase.js deploy
[debug] [2025-06-27T13:09:42.154Z] CLI Version:   13.29.3
[debug] [2025-06-27T13:09:42.154Z] Platform:      win32
[debug] [2025-06-27T13:09:42.154Z] Node Version:  v20.6.1
[debug] [2025-06-27T13:09:42.154Z] Time:          Fri Jun 27 2025 13:09:42 GMT+0000 (Greenwich Mean Time)
[debug] [2025-06-27T13:09:42.154Z] ----------------------------------------------------------------------
[debug] 
[debug] [2025-06-27T13:09:42.393Z] Object "" in "firebase.json" has unknown property: {"additionalProperty":"frameworks"}
[debug] [2025-06-27T13:09:42.397Z] > command requires scopes: ["email","openid","https://www.googleapis.com/auth/cloudplatformprojects.readonly","https://www.googleapis.com/auth/firebase","https://www.googleapis.com/auth/cloud-platform"]
[debug] [2025-06-27T13:09:42.398Z] > authorizing via signed-in user (deekayexq@gmail.com)
[debug] [2025-06-27T13:09:42.398Z] [iam] checking project amplify-ghana for permissions ["firebase.projects.get","firebasehosting.sites.update"]
[debug] [2025-06-27T13:09:42.399Z] Checked if tokens are valid: true, expires at: 1751033221402
[debug] [2025-06-27T13:09:42.399Z] Checked if tokens are valid: true, expires at: 1751033221402
[debug] [2025-06-27T13:09:42.400Z] >>> [apiv2][query] POST https://cloudresourcemanager.googleapis.com/v1/projects/amplify-ghana:testIamPermissions [none]
[debug] [2025-06-27T13:09:42.400Z] >>> [apiv2][(partial)header] POST https://cloudresourcemanager.googleapis.com/v1/projects/amplify-ghana:testIamPermissions x-goog-quota-user=projects/amplify-ghana
[debug] [2025-06-27T13:09:42.400Z] >>> [apiv2][body] POST https://cloudresourcemanager.googleapis.com/v1/projects/amplify-ghana:testIamPermissions {"permissions":["firebase.projects.get","firebasehosting.sites.update"]}
[debug] [2025-06-27T13:09:43.224Z] <<< [apiv2][status] POST https://cloudresourcemanager.googleapis.com/v1/projects/amplify-ghana:testIamPermissions 200
[debug] [2025-06-27T13:09:43.224Z] <<< [apiv2][body] POST https://cloudresourcemanager.googleapis.com/v1/projects/amplify-ghana:testIamPermissions {"permissions":["firebase.projects.get","firebasehosting.sites.update"]}
[debug] [2025-06-27T13:09:43.225Z] Checked if tokens are valid: true, expires at: 1751033221402
[debug] [2025-06-27T13:09:43.225Z] Checked if tokens are valid: true, expires at: 1751033221402
[debug] [2025-06-27T13:09:43.225Z] >>> [apiv2][query] GET https://firebase.googleapis.com/v1beta1/projects/amplify-ghana [none]
[debug] [2025-06-27T13:09:44.165Z] <<< [apiv2][status] GET https://firebase.googleapis.com/v1beta1/projects/amplify-ghana 200
[debug] [2025-06-27T13:09:44.165Z] <<< [apiv2][body] GET https://firebase.googleapis.com/v1beta1/projects/amplify-ghana {"projectId":"amplify-ghana","projectNumber":"278790838056","displayName":"Amplify-Ghana","name":"projects/amplify-ghana","resources":{"hostingSite":"amplify-ghana","locationId":"europe-west6"},"state":"ACTIVE","etag":"1_3d8dcd6e-2509-4f8c-930a-b7688a352170"}
[debug] [2025-06-27T13:09:48.652Z] Checked if tokens are valid: true, expires at: 1751033221402
[debug] [2025-06-27T13:09:48.653Z] Checked if tokens are valid: true, expires at: 1751033221402
[debug] [2025-06-27T13:09:48.653Z] >>> [apiv2][query] GET https://firebasehosting.googleapis.com/v1beta1/projects/amplify-ghana/sites pageToken=&pageSize=10
[debug] [2025-06-27T13:09:50.432Z] <<< [apiv2][status] GET https://firebasehosting.googleapis.com/v1beta1/projects/amplify-ghana/sites 200
[debug] [2025-06-27T13:09:50.432Z] <<< [apiv2][body] GET https://firebasehosting.googleapis.com/v1beta1/projects/amplify-ghana/sites {"sites":[{"name":"projects/amplify-ghana/sites/amplify-ghana","defaultUrl":"https://amplify-ghana.web.app","appId":"1:278790838056:web:d12687053f59e33ecc621d","type":"DEFAULT_SITE"}]}
[debug] [2025-06-27T13:09:50.433Z] Checked if tokens are valid: true, expires at: 1751033221402
[debug] [2025-06-27T13:09:50.433Z] Checked if tokens are valid: true, expires at: 1751033221402
[debug] [2025-06-27T13:09:50.433Z] >>> [apiv2][query] GET https://firebase.googleapis.com/v1beta1/projects/-/webApps/1:278790838056:web:d12687053f59e33ecc621d/config [none]
[debug] [2025-06-27T13:09:51.456Z] <<< [apiv2][status] GET https://firebase.googleapis.com/v1beta1/projects/-/webApps/1:278790838056:web:d12687053f59e33ecc621d/config 200
[debug] [2025-06-27T13:09:51.456Z] <<< [apiv2][body] GET https://firebase.googleapis.com/v1beta1/projects/-/webApps/1:278790838056:web:d12687053f59e33ecc621d/config {"projectId":"amplify-ghana","appId":"1:278790838056:web:d12687053f59e33ecc621d","storageBucket":"amplify-ghana.appspot.com","locationId":"europe-west6","apiKey":"AIzaSyBDLPgELwiKWxGj9ajDEJ2liiMsl2aL3F0","authDomain":"amplify-ghana.firebaseapp.com","messagingSenderId":"278790838056"}
[info] 
   Thank you for trying our early preview of Next.js support on Firebase Hosting.
   During the preview, support is best-effort and breaking changes can be expected. Proceed with caution.

   Documentation: https://firebase.google.com/docs/hosting/frameworks/nextjs
   File a bug: https://github.com/firebase/firebase-tools/issues/new?template=bug_report.md
   Submit a feature request: https://github.com/firebase/firebase-tools/issues/new?template=feature_request.md

   We'd love to learn from you. Express your interest in helping us shape the future of Firebase Hosting: https://goo.gle/41enW5X

[debug] [2025-06-27T13:10:01.413Z] Checked if tokens are valid: true, expires at: 1751033221402
[debug] [2025-06-27T13:10:01.413Z] Checked if tokens are valid: true, expires at: 1751033221402
[debug] [2025-06-27T13:10:01.413Z] >>> [apiv2][query] GET https://firebasehosting.googleapis.com/v1beta1/projects/amplify-ghana/sites/amplify-ghana [none]
[debug] [2025-06-27T13:10:02.679Z] <<< [apiv2][status] GET https://firebasehosting.googleapis.com/v1beta1/projects/amplify-ghana/sites/amplify-ghana 200
[debug] [2025-06-27T13:10:02.679Z] <<< [apiv2][body] GET https://firebasehosting.googleapis.com/v1beta1/projects/amplify-ghana/sites/amplify-ghana {"name":"projects/amplify-ghana/sites/amplify-ghana","defaultUrl":"https://amplify-ghana.web.app","appId":"1:278790838056:web:d12687053f59e33ecc621d","type":"DEFAULT_SITE"}
[info]   ▲ Next.js 14.2.23

[info]   - Environments: .env


[info]    Creating an optimized production build ...

[info] Failed to compile.


[info] ./app/[category]/[articleId]/page.tsx
Error: 
  x Merge conflict marker encountered.
    ,-[C:\Users\Dan\Desktop\projects\amplify-gh-app\app\[category]\[articleId]\page.tsx:22:1]
 22 |         title: "Article Not Found",
 23 |         description: "The article you are looking for does not exist.",
 24 |         images: ["/default-thumbnail.jpg"],
 25 | <<<<<<< HEAD
    : ^^^^^^^
 26 |         url: `https://amplifyghana.com/news/${category}/${articleId}`,
 27 | =======
 27 |         url: `https://mywebsite.com/news/${category}/${articleId}`,
    `----

  x Merge conflict marker encountered.
    ,-[C:\Users\Dan\Desktop\projects\amplify-gh-app\app\[category]\[articleId]\page.tsx:24:1]
 24 |         images: ["/default-thumbnail.jpg"],
 25 | <<<<<<< HEAD
 26 |         url: `https://amplifyghana.com/news/${category}/${articleId}`,
 27 | =======
    : ^^^^^^^
 28 |         url: `https://mywebsite.com/news/${category}/${articleId}`,
 29 | >>>>>>> a01724bb8ae2e78ae0646862e816360def73b6de
 29 |       },
    `----

  x Merge conflict marker encountered.
    ,-[C:\Users\Dan\Desktop\projects\amplify-gh-app\app\[category]\[articleId]\page.tsx:26:1]
 26 |         url: `https://amplifyghana.com/news/${category}/${articleId}`,
 27 | =======
 28 |         url: `https://mywebsite.com/news/${category}/${articleId}`,
 29 | >>>>>>> a01724bb8ae2e78ae0646862e816360def73b6de
    : ^^^^^^^
 30 |       },
 31 |       twitter: {
 31 |         card: "summary_large_image",
    `----

  x Merge conflict marker encountered.
    ,-[C:\Users\Dan\Desktop\projects\amplify-gh-app\app\[category]\[articleId]\page.tsx:41:1]
 41 | 
 42 |   return {
 43 |     title: `${article.title} | Amplify Ghana`,
 44 | <<<<<<< HEAD
    : ^^^^^^^
 45 |     description: article.summary || "Read the latest news and articles here!",
 46 |     openGraph: {
 46 |       title: article.title,
    `----

  x Merge conflict marker encountered.
    ,-[C:\Users\Dan\Desktop\projects\amplify-gh-app\app\[category]\[articleId]\page.tsx:48:1]
 48 |       description: article.summary || "Read the latest news and articles here!",
 49 |       images: [article.image || "/default-thumbnail.jpg"],
 50 |       url: `https://www.amplifyghana.com/${category}/${articleId}`,
 51 | =======
    : ^^^^^^^
 52 |     description: article.description || "Read the latest news and articles here!",
 53 |     openGraph: {
 53 |       title: article.title,
    `----

  x Merge conflict marker encountered.
    ,-[C:\Users\Dan\Desktop\projects\amplify-gh-app\app\[category]\[articleId]\page.tsx:55:1]
 55 |       description: article.description || "Read the latest news and articles here!",
 56 |       images: [article.image || "/default-thumbnail.jpg"],
 57 |       url: `https://mywebsite.com/news/${category}/${articleId}`,
 58 | >>>>>>> a01724bb8ae2e78ae0646862e816360def73b6de
    : ^^^^^^^
 59 |       type: "article",
 60 |     },
 60 |     twitter: {
    `----

  x Merge conflict marker encountered.
    ,-[C:\Users\Dan\Desktop\projects\amplify-gh-app\app\[category]\[articleId]\page.tsx:61:1]
 61 |     twitter: {
 62 |       card: "summary_large_image",
 63 |       title: article.title,
 64 | <<<<<<< HEAD
    : ^^^^^^^
 65 |       description: article.summary || "Check out this article!",
 66 | =======
 66 |       description: article.description || "Check out this article!",
    `----

  x Merge conflict marker encountered.
    ,-[C:\Users\Dan\Desktop\projects\amplify-gh-app\app\[category]\[articleId]\page.tsx:63:1]
 63 |       title: article.title,
 64 | <<<<<<< HEAD
 65 |       description: article.summary || "Check out this article!",
 66 | =======
    : ^^^^^^^
 67 |       description: article.description || "Check out this article!",
 68 | >>>>>>> a01724bb8ae2e78ae0646862e816360def73b6de
 68 |       images: [article.image || "/default-thumbnail.jpg"],
    `----

  x Merge conflict marker encountered.
    ,-[C:\Users\Dan\Desktop\projects\amplify-gh-app\app\[category]\[articleId]\page.tsx:65:1]
 65 |       description: article.summary || "Check out this article!",
 66 | =======
 67 |       description: article.description || "Check out this article!",
 68 | >>>>>>> a01724bb8ae2e78ae0646862e816360def73b6de
    : ^^^^^^^
 69 |       images: [article.image || "/default-thumbnail.jpg"],
 70 |     },
 70 |   };
    `----

  x Expected ',', got ';'
    ,-[C:\Users\Dan\Desktop\projects\amplify-gh-app\app\[category]\[articleId]\page.tsx:68:1]
 68 | >>>>>>> a01724bb8ae2e78ae0646862e816360def73b6de
 69 |       images: [article.image || "/default-thumbnail.jpg"],
 70 |     },
 71 |   };
    :    ^
 72 | }
 73 | 
 73 | const Article = ({ params }: Props) => {
    `----

Caused by:
    Syntax Error

Import trace for requested module:
./app/[category]/[articleId]/page.tsx


[info] uncaughtException [Error: EPERM: operation not permitted, open 'C:\Users\Dan\Desktop\projects\amplify-gh-app\.next\trace'] {
  errno: -4048,
  code: 'EPERM',
  syscall: 'open',
  path: 'C:\\Users\\Dan\\Desktop\\projects\\amplify-gh-app\\.next\\trace'
}

[debug] [2025-06-27T13:10:12.913Z] Error: ENOENT: no such file or directory, open 'C:\Users\Dan\Desktop\projects\amplify-gh-app\.next\server\middleware-manifest.json'
[error] 
[error] Error: An unexpected error has occurred.
[debug] [2025-07-21T10:04:16.751Z] ----------------------------------------------------------------------
[debug] [2025-07-21T10:04:16.755Z] Command:       C:\Program Files\nodejs\node.exe C:\Users\Dan\AppData\Roaming\npm\node_modules\firebase-tools\lib\bin\firebase.js deploy
[debug] [2025-07-21T10:04:16.755Z] CLI Version:   13.29.3
[debug] [2025-07-21T10:04:16.755Z] Platform:      win32
[debug] [2025-07-21T10:04:16.756Z] Node Version:  v20.6.1
[debug] [2025-07-21T10:04:16.756Z] Time:          Mon Jul 21 2025 10:04:16 GMT+0000 (Greenwich Mean Time)
[debug] [2025-07-21T10:04:16.756Z] ----------------------------------------------------------------------
[debug] 
[debug] [2025-07-21T10:04:16.760Z] >>> [apiv2][query] GET https://firebase-public.firebaseio.com/cli.json [none]
[debug] [2025-07-21T10:04:17.016Z] Object "" in "firebase.json" has unknown property: {"additionalProperty":"frameworks"}
[debug] [2025-07-21T10:04:17.022Z] > command requires scopes: ["email","openid","https://www.googleapis.com/auth/cloudplatformprojects.readonly","https://www.googleapis.com/auth/firebase","https://www.googleapis.com/auth/cloud-platform"]
[debug] [2025-07-21T10:04:17.023Z] > authorizing via signed-in user (deekayexq@gmail.com)
[debug] [2025-07-21T10:04:17.023Z] [iam] checking project amplify-ghana for permissions ["firebase.projects.get","firebasehosting.sites.update"]
[debug] [2025-07-21T10:04:17.024Z] Checked if tokens are valid: false, expires at: 1751033221402
[debug] [2025-07-21T10:04:17.024Z] Checked if tokens are valid: false, expires at: 1751033221402
[debug] [2025-07-21T10:04:17.024Z] > refreshing access token with scopes: []
[debug] [2025-07-21T10:04:17.025Z] >>> [apiv2][query] POST https://www.googleapis.com/oauth2/v3/token [none]
[debug] [2025-07-21T10:04:17.025Z] >>> [apiv2][body] POST https://www.googleapis.com/oauth2/v3/token [omitted]
[debug] [2025-07-21T10:04:28.325Z] <<< [apiv2][status] GET https://firebase-public.firebaseio.com/cli.json 200
[debug] [2025-07-21T10:04:28.326Z] <<< [apiv2][body] GET https://firebase-public.firebaseio.com/cli.json {"cloudBuildErrorAfter":1594252800000,"cloudBuildWarnAfter":1590019200000,"defaultNode10After":1594252800000,"minVersion":"3.0.5","node8DeploysDisabledAfter":1613390400000,"node8RuntimeDisabledAfter":1615809600000,"node8WarnAfter":1600128000000}
[debug] [2025-07-21T10:04:28.448Z] <<< [apiv2][status] POST https://www.googleapis.com/oauth2/v3/token 200
[debug] [2025-07-21T10:04:28.448Z] <<< [apiv2][body] POST https://www.googleapis.com/oauth2/v3/token [omitted]
[debug] [2025-07-21T10:04:28.456Z] >>> [apiv2][query] POST https://cloudresourcemanager.googleapis.com/v1/projects/amplify-ghana:testIamPermissions [none]
[debug] [2025-07-21T10:04:28.456Z] >>> [apiv2][(partial)header] POST https://cloudresourcemanager.googleapis.com/v1/projects/amplify-ghana:testIamPermissions x-goog-quota-user=projects/amplify-ghana
[debug] [2025-07-21T10:04:28.456Z] >>> [apiv2][body] POST https://cloudresourcemanager.googleapis.com/v1/projects/amplify-ghana:testIamPermissions {"permissions":["firebase.projects.get","firebasehosting.sites.update"]}
[debug] [2025-07-21T10:04:29.644Z] <<< [apiv2][status] POST https://cloudresourcemanager.googleapis.com/v1/projects/amplify-ghana:testIamPermissions 200
[debug] [2025-07-21T10:04:29.645Z] <<< [apiv2][body] POST https://cloudresourcemanager.googleapis.com/v1/projects/amplify-ghana:testIamPermissions {"permissions":["firebase.projects.get","firebasehosting.sites.update"]}
[debug] [2025-07-21T10:04:29.645Z] Checked if tokens are valid: true, expires at: 1753095867448
[debug] [2025-07-21T10:04:29.645Z] Checked if tokens are valid: true, expires at: 1753095867448
[debug] [2025-07-21T10:04:29.645Z] >>> [apiv2][query] GET https://firebase.googleapis.com/v1beta1/projects/amplify-ghana [none]
[debug] [2025-07-21T10:04:30.274Z] <<< [apiv2][status] GET https://firebase.googleapis.com/v1beta1/projects/amplify-ghana 200
[debug] [2025-07-21T10:04:30.274Z] <<< [apiv2][body] GET https://firebase.googleapis.com/v1beta1/projects/amplify-ghana {"projectId":"amplify-ghana","projectNumber":"278790838056","displayName":"Amplify-Ghana","name":"projects/amplify-ghana","resources":{"hostingSite":"amplify-ghana","locationId":"europe-west6"},"state":"ACTIVE","etag":"1_3d8dcd6e-2509-4f8c-930a-b7688a352170"}
[debug] [2025-07-21T10:04:34.687Z] Checked if tokens are valid: true, expires at: 1753095867448
[debug] [2025-07-21T10:04:34.687Z] Checked if tokens are valid: true, expires at: 1753095867448
[debug] [2025-07-21T10:04:34.687Z] >>> [apiv2][query] GET https://firebasehosting.googleapis.com/v1beta1/projects/amplify-ghana/sites pageToken=&pageSize=10
[debug] [2025-07-21T10:04:36.024Z] <<< [apiv2][status] GET https://firebasehosting.googleapis.com/v1beta1/projects/amplify-ghana/sites 200
[debug] [2025-07-21T10:04:36.024Z] <<< [apiv2][body] GET https://firebasehosting.googleapis.com/v1beta1/projects/amplify-ghana/sites {"sites":[{"name":"projects/amplify-ghana/sites/amplify-ghana","defaultUrl":"https://amplify-ghana.web.app","appId":"1:278790838056:web:d12687053f59e33ecc621d","type":"DEFAULT_SITE"}]}
[debug] [2025-07-21T10:04:36.024Z] Checked if tokens are valid: true, expires at: 1753095867448
[debug] [2025-07-21T10:04:36.024Z] Checked if tokens are valid: true, expires at: 1753095867448
[debug] [2025-07-21T10:04:36.025Z] >>> [apiv2][query] GET https://firebase.googleapis.com/v1beta1/projects/-/webApps/1:278790838056:web:d12687053f59e33ecc621d/config [none]
[debug] [2025-07-21T10:04:37.092Z] <<< [apiv2][status] GET https://firebase.googleapis.com/v1beta1/projects/-/webApps/1:278790838056:web:d12687053f59e33ecc621d/config 200
[debug] [2025-07-21T10:04:37.093Z] <<< [apiv2][body] GET https://firebase.googleapis.com/v1beta1/projects/-/webApps/1:278790838056:web:d12687053f59e33ecc621d/config {"projectId":"amplify-ghana","appId":"1:278790838056:web:d12687053f59e33ecc621d","storageBucket":"amplify-ghana.appspot.com","locationId":"europe-west6","apiKey":"AIzaSyBDLPgELwiKWxGj9ajDEJ2liiMsl2aL3F0","authDomain":"amplify-ghana.firebaseapp.com","messagingSenderId":"278790838056"}
[info] 
   Thank you for trying our early preview of Next.js support on Firebase Hosting.
   During the preview, support is best-effort and breaking changes can be expected. Proceed with caution.

   Documentation: https://firebase.google.com/docs/hosting/frameworks/nextjs
   File a bug: https://github.com/firebase/firebase-tools/issues/new?template=bug_report.md
   Submit a feature request: https://github.com/firebase/firebase-tools/issues/new?template=feature_request.md

   We'd love to learn from you. Express your interest in helping us shape the future of Firebase Hosting: https://goo.gle/41enW5X

[debug] [2025-07-21T10:04:45.631Z] Checked if tokens are valid: true, expires at: 1753095867448
[debug] [2025-07-21T10:04:45.631Z] Checked if tokens are valid: true, expires at: 1753095867448
[debug] [2025-07-21T10:04:45.631Z] >>> [apiv2][query] GET https://firebasehosting.googleapis.com/v1beta1/projects/amplify-ghana/sites/amplify-ghana [none]
[debug] [2025-07-21T10:04:46.708Z] <<< [apiv2][status] GET https://firebasehosting.googleapis.com/v1beta1/projects/amplify-ghana/sites/amplify-ghana 200
[debug] [2025-07-21T10:04:46.708Z] <<< [apiv2][body] GET https://firebasehosting.googleapis.com/v1beta1/projects/amplify-ghana/sites/amplify-ghana {"name":"projects/amplify-ghana/sites/amplify-ghana","defaultUrl":"https://amplify-ghana.web.app","appId":"1:278790838056:web:d12687053f59e33ecc621d","type":"DEFAULT_SITE"}
[info]   ▲ Next.js 14.2.23

[info]   - Environments: .env


[info]    Creating an optimized production build ...

[info] Browserslist: caniuse-lite is outdated. Please run:
  npx update-browserslist-db@latest
  Why you should do it regularly: https://github.com/browserslist/update-db#readme

[info] Failed to compile.


[info] ./app/[category]/[articleId]/page.tsx
Error: 
  x Merge conflict marker encountered.
    ,-[C:\Users\Dan\Desktop\projects\amplify-gh-app\app\[category]\[articleId]\page.tsx:22:1]
 22 |         title: "Article Not Found",
 23 |         description: "The article you are looking for does not exist.",
 24 |         images: ["/default-thumbnail.jpg"],
 25 | <<<<<<< HEAD
    : ^^^^^^^
 26 |         url: `https://amplifyghana.com/news/${category}/${articleId}`,
 27 | =======
 27 |         url: `https://mywebsite.com/news/${category}/${articleId}`,
    `----

  x Merge conflict marker encountered.
    ,-[C:\Users\Dan\Desktop\projects\amplify-gh-app\app\[category]\[articleId]\page.tsx:24:1]
 24 |         images: ["/default-thumbnail.jpg"],
 25 | <<<<<<< HEAD
 26 |         url: `https://amplifyghana.com/news/${category}/${articleId}`,
 27 | =======
    : ^^^^^^^
 28 |         url: `https://mywebsite.com/news/${category}/${articleId}`,
 29 | >>>>>>> a01724bb8ae2e78ae0646862e816360def73b6de
 29 |       },
    `----

  x Merge conflict marker encountered.
    ,-[C:\Users\Dan\Desktop\projects\amplify-gh-app\app\[category]\[articleId]\page.tsx:26:1]
 26 |         url: `https://amplifyghana.com/news/${category}/${articleId}`,
 27 | =======
 28 |         url: `https://mywebsite.com/news/${category}/${articleId}`,
 29 | >>>>>>> a01724bb8ae2e78ae0646862e816360def73b6de
    : ^^^^^^^
 30 |       },
 31 |       twitter: {
 31 |         card: "summary_large_image",
    `----

  x Merge conflict marker encountered.
    ,-[C:\Users\Dan\Desktop\projects\amplify-gh-app\app\[category]\[articleId]\page.tsx:41:1]
 41 | 
 42 |   return {
 43 |     title: `${article.title} | Amplify Ghana`,
 44 | <<<<<<< HEAD
    : ^^^^^^^
 45 |     description: article.summary || "Read the latest news and articles here!",
 46 |     openGraph: {
 46 |       title: article.title,
    `----

  x Merge conflict marker encountered.
    ,-[C:\Users\Dan\Desktop\projects\amplify-gh-app\app\[category]\[articleId]\page.tsx:48:1]
 48 |       description: article.summary || "Read the latest news and articles here!",
 49 |       images: [article.image || "/default-thumbnail.jpg"],
 50 |       url: `https://www.amplifyghana.com/${category}/${articleId}`,
 51 | =======
    : ^^^^^^^
 52 |     description: article.description || "Read the latest news and articles here!",
 53 |     openGraph: {
 53 |       title: article.title,
    `----

  x Merge conflict marker encountered.
    ,-[C:\Users\Dan\Desktop\projects\amplify-gh-app\app\[category]\[articleId]\page.tsx:55:1]
 55 |       description: article.description || "Read the latest news and articles here!",
 56 |       images: [article.image || "/default-thumbnail.jpg"],
 57 |       url: `https://mywebsite.com/news/${category}/${articleId}`,
 58 | >>>>>>> a01724bb8ae2e78ae0646862e816360def73b6de
    : ^^^^^^^
 59 |       type: "article",
 60 |     },
 60 |     twitter: {
    `----

  x Merge conflict marker encountered.
    ,-[C:\Users\Dan\Desktop\projects\amplify-gh-app\app\[category]\[articleId]\page.tsx:61:1]
 61 |     twitter: {
 62 |       card: "summary_large_image",
 63 |       title: article.title,
 64 | <<<<<<< HEAD
    : ^^^^^^^
 65 |       description: article.summary || "Check out this article!",
 66 | =======
 66 |       description: article.description || "Check out this article!",
    `----

  x Merge conflict marker encountered.
    ,-[C:\Users\Dan\Desktop\projects\amplify-gh-app\app\[category]\[articleId]\page.tsx:63:1]
 63 |       title: article.title,
 64 | <<<<<<< HEAD
 65 |       description: article.summary || "Check out this article!",
 66 | =======
    : ^^^^^^^
 67 |       description: article.description || "Check out this article!",
 68 | >>>>>>> a01724bb8ae2e78ae0646862e816360def73b6de
 68 |       images: [article.image || "/default-thumbnail.jpg"],
    `----

  x Merge conflict marker encountered.
    ,-[C:\Users\Dan\Desktop\projects\amplify-gh-app\app\[category]\[articleId]\page.tsx:65:1]
 65 |       description: article.summary || "Check out this article!",
 66 | =======
 67 |       description: article.description || "Check out this article!",
 68 | >>>>>>> a01724bb8ae2e78ae0646862e816360def73b6de
    : ^^^^^^^
 69 |       images: [article.image || "/default-thumbnail.jpg"],
 70 |     },
 70 |   };
    `----

  x Expected ',', got ';'
    ,-[C:\Users\Dan\Desktop\projects\amplify-gh-app\app\[category]\[articleId]\page.tsx:68:1]
 68 | >>>>>>> a01724bb8ae2e78ae0646862e816360def73b6de
 69 |       images: [article.image || "/default-thumbnail.jpg"],
 70 |     },
 71 |   };
    :    ^
 72 | }
 73 | 
 73 | const Article = ({ params }: Props) => {
    `----

Caused by:
    Syntax Error

Import trace for requested module:
./app/[category]/[articleId]/page.tsx


[info] 

[info] > Build failed because of webpack errors

[debug] [2025-07-21T10:04:56.327Z] Error: ENOENT: no such file or directory, open 'C:\Users\Dan\Desktop\projects\amplify-gh-app\.next\server\middleware-manifest.json'
[error] 
[error] Error: An unexpected error has occurred.
